{
  "schemaVersion": "skill-contract/v1",
  "skillId": "ch06-02-match-s1",
  "name": "ch06-02-match-s1",
  "description": "match 控制流与穷举模式匹配：每个 match 分支相关联的代码是一个表达式，其表达式的结果值将作为整个 match 表达式的返回值；适用于当 match 表达式执行并匹配某个分支时、当将枚举值 `Some(5)` 与模式 `Some(i)` 进行比较时、当某个分支的模式与当前值匹配成功时。",
  "references": [],
  "overflow": {
    "applied": false
  },
  "promotionState": "assembled",
  "gateReceipt": {
    "passed": true,
    "reasonCodes": [],
    "bytes": 6761,
    "markdownHash": "sha256:446edf3d3e4b7842005aeeb7f3ad90a30309e1e549ffe78aa3f67d4c4317ca2a",
    "checkedAt": "2026-10-14T12:42:03.482Z"
  },
  "inputContract": null,
  "outputContract": null,
  "tools": [],
  "steps": [],
  "stopConditions": [],
  "rollback": null,
  "tests": [],
  "sourceObjects": [
    "CH06-02-MATCH-H2-1-CONCEPT-01",
    "CH06-02-MATCH-H2-1-ENGINEERINGRULE-02",
    "CH06-02-MATCH-H3-1-CONCEPT-01",
    "CH06-02-MATCH-H3-1-CONCEPT-02",
    "CH06-02-MATCH-H3-2-CONCEPT-01",
    "CH06-02-MATCH-H4-1-ENGINEERINGRULE-01",
    "CH06-02-MATCH-H4-1-ENGINEERINGRULE-02",
    "CH06-02-MATCH-H3-3-ENGINEERINGRULE-01",
    "CH06-02-MATCH-H3-4-ENGINEERINGRULE-01",
    "CH06-02-MATCH-H3-4-CONCEPT-02",
    "CH06-03-IF-LET-H2-1-CONCEPT-01",
    "CH06-03-IF-LET-H2-1-HEURISTIC-02",
    "CH06-03-IF-LET-H2-2-HEURISTIC-01"
  ],
  "crossChapterObjects": [
    "AP-SYNTH-T04-03",
    "AP-SYNTH-T04-04",
    "AP-SYNTH-T04-05"
  ],
  "sourceRefs": [
    {
      "file": "sources/rust-book-cn/book/ch06-02-match.md",
      "anchor": "ch06-02-match#h2-1",
      "title": "`match` 控制流运算符",
      "lineStart": 1,
      "lineEnd": 28
    },
    {
      "file": "sources/rust-book-cn/book/ch06-02-match.md",
      "anchor": "ch06-02-match#h3-1",
      "title": "绑定值的模式",
      "lineStart": 29,
      "lineEnd": 50
    },
    {
      "file": "sources/rust-book-cn/book/ch06-02-match.md",
      "anchor": "ch06-02-match#h3-2",
      "title": "匹配 `Option<T>`",
      "lineStart": 51,
      "lineEnd": 64
    },
    {
      "file": "sources/rust-book-cn/book/ch06-02-match.md",
      "anchor": "ch06-02-match#h4-1",
      "title": "匹配 `Some(T)`",
      "lineStart": 65,
      "lineEnd": 90
    },
    {
      "file": "sources/rust-book-cn/book/ch06-02-match.md",
      "anchor": "ch06-02-match#h3-3",
      "title": "匹配是穷尽的",
      "lineStart": 91,
      "lineEnd": 106
    },
    {
      "file": "sources/rust-book-cn/book/ch06-02-match.md",
      "anchor": "ch06-02-match#h3-4",
      "title": "通配模式和 `_` 占位符",
      "lineStart": 107,
      "lineEnd": 141
    },
    {
      "file": "sources/rust-book-cn/book/ch06-03-if-let.md",
      "anchor": "ch06-03-if-let#h2-1",
      "title": "`if let` 简单控制流",
      "lineStart": 1,
      "lineEnd": 80
    },
    {
      "file": "sources/rust-book-cn/book/ch06-03-if-let.md",
      "anchor": "ch06-03-if-let#h2-2",
      "title": "总结",
      "lineStart": 81,
      "lineEnd": 88
    },
    {
      "file": "sources/rust-book-cn/book/ch06-01-defining-an-enum.md",
      "anchor": "ch06-01-defining-an-enum#h3-2",
      "title": "`Option` 枚举和其相对于空值的优势",
      "lineStart": 194,
      "lineEnd": 266
    },
    {
      "file": "sources/rust-book-cn/book/ch18-01-all-the-places-for-patterns.md",
      "anchor": "ch18-01-all-the-places-for-patterns#h3-1",
      "title": "`match` 分支",
      "lineStart": 5,
      "lineEnd": 20
    },
    {
      "file": "sources/rust-book-cn/book/ch18-01-all-the-places-for-patterns.md",
      "anchor": "ch18-01-all-the-places-for-patterns#h3-2",
      "title": "`if let` 条件表达式",
      "lineStart": 21,
      "lineEnd": 62
    }
  ],
  "codeSource": {
    "available": false,
    "note": "> 本段无来源：信息源未提供目录化的配套代码（`sources/<源键>/code/` 无可消费目录）。按**源条件骨架**（ADR-029），本段以来源说明代替空段——请勿读成「源里有代码但没写」。"
  },
  "evidenceGrade": "E2-derived",
  "freshness": {
    "state": "fresh",
    "asOf": "2026-10-14T12:42:03.482Z"
  },
  "gaps": [
    {
      "code": "SECTION_ITEM_COUNT_BELOW_ADVISORY",
      "section": "pitfalls",
      "heading": "## 常见陷阱",
      "detail": "条目数 3 低于骨架的建议值（列表，6–8 条反模式）。**建议值不是判据**——原书那 6–8 条出自人工写作，自动提取达不到该量级（实测整章仅 5 条）。本项按 ADR-006 门禁三「AntiPattern 覆盖率低的 skill 属高风险」路由到功效抽样重点，不在门禁一处拒绝。",
      "advisory": 6,
      "actual": 3
    },
    {
      "code": "SECTION_SOURCE_ABSENT",
      "section": "code",
      "heading": "## 配套代码",
      "detail": "本段的来源是镜像的代码树（`sources/<源键>/code/`），信息源未提供可消费的目录形态。按源条件骨架（ADR-029），本段以**来源说明**代替空段——「空」与「无」必须长得不一样。",
      "advisory": 1,
      "actual": 0
    },
    {
      "code": "SECTION_FIELD_SEMANTICS_MISMATCH",
      "section": "patterns",
      "heading": "## 实践模式",
      "detail": "本段由 `Concept.definition` + `examples` 填充，装出来的是**术语定义**，而骨架要求的是**可操作的模式**（编号子节、含表格）。条目数达标不代表语义达标——这类缺口计数查不出来。",
      "required": null,
      "actual": 6
    },
    {
      "code": "CONTRACT_FIELD_UNSUPPORTED",
      "section": "contract.inputContract",
      "heading": "契约字段 inputContract",
      "detail": "输入契约。没有任何对象字段描述「这个 skill 要什么输入」。",
      "required": null,
      "actual": 0
    },
    {
      "code": "CONTRACT_FIELD_UNSUPPORTED",
      "section": "contract.outputContract",
      "heading": "契约字段 outputContract",
      "detail": "输出契约。同上。",
      "required": null,
      "actual": 0
    },
    {
      "code": "CONTRACT_FIELD_UNSUPPORTED",
      "section": "contract.tools",
      "heading": "契约字段 tools",
      "detail": "工具清单。对象模型里没有工具/依赖类字段。",
      "required": null,
      "actual": 0
    },
    {
      "code": "CONTRACT_FIELD_UNSUPPORTED",
      "section": "contract.steps",
      "heading": "契约字段 steps",
      "detail": "可执行步骤。步骤属「实践模式」段的语义，而该段当前由 Concept 定义填充。",
      "required": null,
      "actual": 0
    },
    {
      "code": "CONTRACT_FIELD_UNSUPPORTED",
      "section": "contract.stopConditions",
      "heading": "契约字段 stopConditions",
      "detail": "停止条件。没有对象字段承载。",
      "required": null,
      "actual": 0
    },
    {
      "code": "CONTRACT_FIELD_UNSUPPORTED",
      "section": "contract.rollback",
      "heading": "契约字段 rollback",
      "detail": "回滚方式。没有对象字段承载。",
      "required": null,
      "actual": 0
    },
    {
      "code": "CONTRACT_FIELD_UNSUPPORTED",
      "section": "contract.tests",
      "heading": "契约字段 tests",
      "detail": "ADR-004 要求 ≥2。没有任何对象字段承载「这个 skill 怎么测」。",
      "required": null,
      "actual": 0
    }
  ],
  "sectionCounts": {
    "whenToUse": 7,
    "principles": 5,
    "patterns": 6,
    "pitfalls": 3,
    "code": 0,
    "reading": 11
  },
  "riskFlags": [
    {
      "flag": "PITFALL_COVERAGE_BELOW_ADVISORY",
      "detail": "anti-pattern 覆盖不足：常见陷阱段 3 条，建议值 6 条。",
      "routing": "按 ADR-006 门禁三，本 skill 属高风险，抽样时优先覆盖。"
    }
  ],
  "gapCodes": [
    "SECTION_ITEM_COUNT_BELOW_ADVISORY",
    "SECTION_SOURCE_ABSENT",
    "SECTION_FIELD_SEMANTICS_MISMATCH",
    "CONTRACT_FIELD_UNSUPPORTED",
    "CONTRACT_FIELD_UNSUPPORTED",
    "CONTRACT_FIELD_UNSUPPORTED",
    "CONTRACT_FIELD_UNSUPPORTED",
    "CONTRACT_FIELD_UNSUPPORTED",
    "CONTRACT_FIELD_UNSUPPORTED",
    "CONTRACT_FIELD_UNSUPPORTED"
  ],
  "provenance": {
    "sourceFile": "sources/rust-book-cn/book/ch06-02-match.md",
    "anchorIndexHash": "sha256:8a1eb0b0bfaf1a44c98dccad4c22bed80f30010b9db6c5cbb139b3af663a0099",
    "anchorIndexHashes": {
      "sources/rust-book-cn/book/ch06-02-match.md": "sha256:8a1eb0b0bfaf1a44c98dccad4c22bed80f30010b9db6c5cbb139b3af663a0099",
      "sources/rust-book-cn/book/ch06-03-if-let.md": "sha256:9e982eef4e66b2e4ebab6f1f05551e8ff4f14c1d0e3796d8c930f1d2505ac111",
      "sources/rust-book-cn/book/ch06-01-defining-an-enum.md": "sha256:757a14c8724baabfe6ad89c8c6275a3c8e8ac85c007fc21e66623a1be8fb97c8",
      "sources/rust-book-cn/book/ch18-01-all-the-places-for-patterns.md": "sha256:c24ae69ac3b439ff30bfea9302cecd601c4d65fbfb56a698e77ee85aded14878"
    },
    "objectsFile": "pipeline/knowledge/ch06-02-match.objects.json + pipeline/knowledge/ch06-03-if-let.objects.json",
    "objectsFileSha256": "sha256:aab022dc73a75f9025d903d0df75743e857bf35613eba9000cd4f8e37210cb26",
    "objectsTotal": 13,
    "objectsInCluster": 13,
    "objectsKept": 13,
    "objectsExcludedByGate": [],
    "crossChapterTotal": 95,
    "crossChapterInCluster": 3,
    "crossChapterKept": 3,
    "crossChapterExcludedByGate": [],
    "antipatternVerdictsFile": "pipeline/registry/run-fd491f2468f0.antipattern-verdicts.json",
    "antipatternVerdictsRunId": "run-fd491f2468f0",
    "antipatternVerdictsIdentityMatch": true,
    "antipatternObjectsRunId": "run-fd491f2468f0",
    "gateReceiptFile": "pipeline/registry/run-d0c2f574121d.receipt.json",
    "gateReceiptRunId": "run-d0c2f574121d",
    "clusterSource": "pipeline/knowledge/clusters.rust-book-cn.json",
    "clusterSkillId": "ch06-02-match-s1",
    "clusterUnits": [
      "ch06-02-match-u1",
      "ch06-02-match-u2",
      "ch06-02-match-u3",
      "ch06-03-if-let-u1"
    ],
    "clusterChapterRefs": [
      "ch06-02-match",
      "ch06-03-if-let"
    ],
    "clustersFile": "pipeline/knowledge/clusters.rust-book-cn.json"
  }
}
