{
  "schemaVersion": "skill-contract/v1",
  "skillId": "ch04-03-slices-s1",
  "name": "ch04-03-slices-s1",
  "description": "Rust 切片类型使用：字符串 slice range 的索引必须位于有效的 UTF-8 字符边界内；适用于使用字符串 slice range 的索引创建 slice 时、存在某值的不可变引用，且同时需要获取可变引用时、当函数需要接受字符串 slice 或 `String` 值时。",
  "references": [],
  "overflow": {
    "applied": false
  },
  "promotionState": "assembled",
  "gateReceipt": {
    "passed": true,
    "reasonCodes": [],
    "bytes": 3228,
    "markdownHash": "sha256:ae7be10764dec2520cc8d159115e6402cee093f207a3607eb3a1d2d52a688880",
    "checkedAt": "2026-10-14T12:42:03.017Z"
  },
  "inputContract": null,
  "outputContract": null,
  "tools": [],
  "steps": [],
  "stopConditions": [],
  "rollback": null,
  "tests": [],
  "sourceObjects": [
    "CH04-03-SLICES-H2-1-ANTIPATTERN-01",
    "CH04-03-SLICES-H3-1-ENGINEERINGRULE-01",
    "CH04-03-SLICES-H3-1-ENGINEERINGRULE-02",
    "CH04-03-SLICES-H4-1-CONCEPT-01",
    "CH04-03-SLICES-H4-2-HEURISTIC-01",
    "CH04-03-SLICES-H3-2-CONCEPT-01"
  ],
  "crossChapterObjects": [
    "AP-SYNTH-T01-05"
  ],
  "sourceRefs": [
    {
      "file": "sources/rust-book-cn/book/ch04-03-slices.md",
      "anchor": "ch04-03-slices#h2-1",
      "title": "切片 Slice 类型",
      "lineStart": 1,
      "lineEnd": 66
    },
    {
      "file": "sources/rust-book-cn/book/ch04-03-slices.md",
      "anchor": "ch04-03-slices#h3-1",
      "title": "字符串 slice",
      "lineStart": 67,
      "lineEnd": 151
    },
    {
      "file": "sources/rust-book-cn/book/ch04-03-slices.md",
      "anchor": "ch04-03-slices#h4-1",
      "title": "字符串字面量就是 slice",
      "lineStart": 152,
      "lineEnd": 161
    },
    {
      "file": "sources/rust-book-cn/book/ch04-03-slices.md",
      "anchor": "ch04-03-slices#h4-2",
      "title": "字符串 slice 作为参数",
      "lineStart": 162,
      "lineEnd": 185
    },
    {
      "file": "sources/rust-book-cn/book/ch04-03-slices.md",
      "anchor": "ch04-03-slices#h3-2",
      "title": "其他类型的 slice",
      "lineStart": 186,
      "lineEnd": 203
    }
  ],
  "codeSource": {
    "available": false,
    "note": "> 本段无来源：信息源未提供目录化的配套代码（`sources/<源键>/code/` 无可消费目录）。按**源条件骨架**（ADR-029），本段以来源说明代替空段——请勿读成「源里有代码但没写」。"
  },
  "evidenceGrade": "E2-derived",
  "freshness": {
    "state": "fresh",
    "asOf": "2026-10-14T12:42:03.017Z"
  },
  "gaps": [
    {
      "code": "SECTION_ITEM_COUNT_BELOW_ADVISORY",
      "section": "whenToUse",
      "heading": "## 何时使用",
      "detail": "条目数 3 低于骨架的建议值（列表，5–8 条用户场景/触发条件）。**建议值不是判据**——原书那 6–8 条出自人工写作，自动提取达不到该量级（实测整章仅 5 条）。本项按 ADR-006 门禁三「AntiPattern 覆盖率低的 skill 属高风险」路由到功效抽样重点，不在门禁一处拒绝。",
      "advisory": 5,
      "actual": 3
    },
    {
      "code": "SECTION_ITEM_COUNT_BELOW_ADVISORY",
      "section": "pitfalls",
      "heading": "## 常见陷阱",
      "detail": "条目数 2 低于骨架的建议值（列表，6–8 条反模式）。**建议值不是判据**——原书那 6–8 条出自人工写作，自动提取达不到该量级（实测整章仅 5 条）。本项按 ADR-006 门禁三「AntiPattern 覆盖率低的 skill 属高风险」路由到功效抽样重点，不在门禁一处拒绝。",
      "advisory": 6,
      "actual": 2
    },
    {
      "code": "SECTION_SOURCE_ABSENT",
      "section": "code",
      "heading": "## 配套代码",
      "detail": "本段的来源是镜像的代码树（`sources/<源键>/code/`），信息源未提供可消费的目录形态。按源条件骨架（ADR-029），本段以**来源说明**代替空段——「空」与「无」必须长得不一样。",
      "advisory": 1,
      "actual": 0
    },
    {
      "code": "SECTION_FIELD_SEMANTICS_MISMATCH",
      "section": "patterns",
      "heading": "## 实践模式",
      "detail": "本段由 `Concept.definition` + `examples` 填充，装出来的是**术语定义**，而骨架要求的是**可操作的模式**（编号子节、含表格）。条目数达标不代表语义达标——这类缺口计数查不出来。",
      "required": null,
      "actual": 2
    },
    {
      "code": "CONTRACT_FIELD_UNSUPPORTED",
      "section": "contract.inputContract",
      "heading": "契约字段 inputContract",
      "detail": "输入契约。没有任何对象字段描述「这个 skill 要什么输入」。",
      "required": null,
      "actual": 0
    },
    {
      "code": "CONTRACT_FIELD_UNSUPPORTED",
      "section": "contract.outputContract",
      "heading": "契约字段 outputContract",
      "detail": "输出契约。同上。",
      "required": null,
      "actual": 0
    },
    {
      "code": "CONTRACT_FIELD_UNSUPPORTED",
      "section": "contract.tools",
      "heading": "契约字段 tools",
      "detail": "工具清单。对象模型里没有工具/依赖类字段。",
      "required": null,
      "actual": 0
    },
    {
      "code": "CONTRACT_FIELD_UNSUPPORTED",
      "section": "contract.steps",
      "heading": "契约字段 steps",
      "detail": "可执行步骤。步骤属「实践模式」段的语义，而该段当前由 Concept 定义填充。",
      "required": null,
      "actual": 0
    },
    {
      "code": "CONTRACT_FIELD_UNSUPPORTED",
      "section": "contract.stopConditions",
      "heading": "契约字段 stopConditions",
      "detail": "停止条件。没有对象字段承载。",
      "required": null,
      "actual": 0
    },
    {
      "code": "CONTRACT_FIELD_UNSUPPORTED",
      "section": "contract.rollback",
      "heading": "契约字段 rollback",
      "detail": "回滚方式。没有对象字段承载。",
      "required": null,
      "actual": 0
    },
    {
      "code": "CONTRACT_FIELD_UNSUPPORTED",
      "section": "contract.tests",
      "heading": "契约字段 tests",
      "detail": "ADR-004 要求 ≥2。没有任何对象字段承载「这个 skill 怎么测」。",
      "required": null,
      "actual": 0
    }
  ],
  "sectionCounts": {
    "whenToUse": 3,
    "principles": 2,
    "patterns": 2,
    "pitfalls": 2,
    "code": 0,
    "reading": 5
  },
  "riskFlags": [
    {
      "flag": "PITFALL_COVERAGE_BELOW_ADVISORY",
      "detail": "anti-pattern 覆盖不足：常见陷阱段 2 条，建议值 6 条。",
      "routing": "按 ADR-006 门禁三，本 skill 属高风险，抽样时优先覆盖。"
    }
  ],
  "gapCodes": [
    "SECTION_ITEM_COUNT_BELOW_ADVISORY",
    "SECTION_ITEM_COUNT_BELOW_ADVISORY",
    "SECTION_SOURCE_ABSENT",
    "SECTION_FIELD_SEMANTICS_MISMATCH",
    "CONTRACT_FIELD_UNSUPPORTED",
    "CONTRACT_FIELD_UNSUPPORTED",
    "CONTRACT_FIELD_UNSUPPORTED",
    "CONTRACT_FIELD_UNSUPPORTED",
    "CONTRACT_FIELD_UNSUPPORTED",
    "CONTRACT_FIELD_UNSUPPORTED",
    "CONTRACT_FIELD_UNSUPPORTED"
  ],
  "provenance": {
    "sourceFile": "sources/rust-book-cn/book/ch04-03-slices.md",
    "anchorIndexHash": "sha256:dd6f1aa6f2852e759f9cd442c4eabe1f3d6b2e7f23d373b59514ae42eefe857f",
    "anchorIndexHashes": {
      "sources/rust-book-cn/book/ch04-03-slices.md": "sha256:dd6f1aa6f2852e759f9cd442c4eabe1f3d6b2e7f23d373b59514ae42eefe857f"
    },
    "objectsFile": "pipeline/knowledge/ch04-03-slices.objects.json",
    "objectsFileSha256": "sha256:0a8f8e2b3f76bad1887810f5f7581ccee3e9beac40d3e8dcd1ee677c438b048a",
    "objectsTotal": 6,
    "objectsInCluster": 6,
    "objectsKept": 6,
    "objectsExcludedByGate": [],
    "crossChapterTotal": 95,
    "crossChapterInCluster": 1,
    "crossChapterKept": 1,
    "crossChapterExcludedByGate": [],
    "antipatternVerdictsFile": "pipeline/registry/run-fd491f2468f0.antipattern-verdicts.json",
    "antipatternVerdictsRunId": "run-fd491f2468f0",
    "antipatternVerdictsIdentityMatch": true,
    "antipatternObjectsRunId": "run-fd491f2468f0",
    "gateReceiptFile": "pipeline/registry/run-39272354acb5.receipt.json",
    "gateReceiptRunId": "run-39272354acb5",
    "clusterSource": "pipeline/knowledge/clusters.rust-book-cn.json",
    "clusterSkillId": "ch04-03-slices-s1",
    "clusterUnits": [
      "ch04-03-slices-u1",
      "ch04-03-slices-u2",
      "ch04-03-slices-u3"
    ],
    "clusterChapterRefs": [
      "ch04-03-slices"
    ],
    "clustersFile": "pipeline/knowledge/clusters.rust-book-cn.json"
  }
}
