{
  "schemaVersion": "skill-contract/v1",
  "skillId": "chapter9-s2",
  "name": "chapter9-s2",
  "description": "学习载体与自进化更新：修改应是带来源的最小 diff，而不是让模型每次都重写整份 Prompt；适用于修改 Prompt 时、判断某项目标能力能否被外部符号较完整地表达，还是需要写入模型参数时、需要利用经过评价的生产轨迹支撑模型持续进化时。",
  "references": [],
  "overflow": {
    "applied": false
  },
  "promotionState": "assembled",
  "gateReceipt": {
    "passed": true,
    "reasonCodes": [],
    "bytes": 8713,
    "markdownHash": "sha256:1870240d143f7fb992634d5770a9c359c9b7c86724cd3ceb48d0cc0bca2aa24b",
    "checkedAt": "2026-10-13T12:55:06.334Z"
  },
  "inputContract": null,
  "outputContract": null,
  "tools": [],
  "steps": [],
  "stopConditions": [],
  "rollback": null,
  "tests": [],
  "sourceObjects": [
    "AFTERWORD-H1-1-CONCEPT-01",
    "AFTERWORD-H2-1-CONCEPT-01",
    "AFTERWORD-H2-1-CONCEPT-02",
    "AFTERWORD-H2-2-CONCEPT-01",
    "AFTERWORD-H2-2-HEURISTIC-02",
    "CHAPTER9-H2-2-CONCEPT-01",
    "CHAPTER9-H2-2-DECISIONMODEL-02",
    "CHAPTER9-H3-2-CONCEPT-01",
    "CHAPTER9-H3-2-ENGINEERINGRULE-02",
    "CHAPTER9-H3-4-ENGINEERINGRULE-01",
    "CHAPTER9-H3-4-ENGINEERINGRULE-02",
    "CHAPTER9-H3-5-CONCEPT-01",
    "CHAPTER9-H3-5-ANTIPATTERN-02",
    "CHAPTER9-H2-3-CONCEPT-01",
    "CHAPTER9-H2-3-ENGINEERINGRULE-02"
  ],
  "crossChapterObjects": [],
  "sourceRefs": [
    {
      "file": "sources/ai-agent-book-zh/book/afterword.md",
      "anchor": "afterword#h1-1",
      "title": "后记：回到 Agent = LLM + 上下文 + 工具",
      "lineStart": 1,
      "lineEnd": 12
    },
    {
      "file": "sources/ai-agent-book-zh/book/afterword.md",
      "anchor": "afterword#h2-1",
      "title": "两朵乌云",
      "lineStart": 13,
      "lineEnd": 26
    },
    {
      "file": "sources/ai-agent-book-zh/book/afterword.md",
      "anchor": "afterword#h2-2",
      "title": "模型与 Agent 的共同演进",
      "lineStart": 27,
      "lineEnd": 44
    },
    {
      "file": "sources/ai-agent-book-zh/book/chapter9.md",
      "anchor": "chapter9#h2-2",
      "title": "Agent 持续进化的四种方法",
      "lineStart": 56,
      "lineEnd": 74
    },
    {
      "file": "sources/ai-agent-book-zh/book/chapter9.md",
      "anchor": "chapter9#h3-2",
      "title": "将经验写成指令",
      "lineStart": 97,
      "lineEnd": 104
    },
    {
      "file": "sources/ai-agent-book-zh/book/chapter9.md",
      "anchor": "chapter9#h3-4",
      "title": "将经验写入参数",
      "lineStart": 248,
      "lineEnd": 255
    },
    {
      "file": "sources/ai-agent-book-zh/book/chapter9.md",
      "anchor": "chapter9#h3-5",
      "title": "从更新产物到更新“更新方法”",
      "lineStart": 256,
      "lineEnd": 285
    },
    {
      "file": "sources/ai-agent-book-zh/book/chapter9.md",
      "anchor": "chapter9#h2-3",
      "title": "构建可长期运行的持续进化闭环",
      "lineStart": 286,
      "lineEnd": 328
    }
  ],
  "evidenceGrade": "E2-derived",
  "freshness": {
    "state": "fresh",
    "asOf": "2026-10-13T12:55:06.334Z"
  },
  "gaps": [
    {
      "code": "SECTION_ITEM_COUNT_BELOW_ADVISORY",
      "section": "pitfalls",
      "heading": "## 常见陷阱",
      "detail": "条目数 1 低于骨架的建议值（列表，6–8 条反模式）。**建议值不是判据**——原书那 6–8 条出自人工写作，自动提取达不到该量级（实测整章仅 5 条）。本项按 ADR-006 门禁三「AntiPattern 覆盖率低的 skill 属高风险」路由到功效抽样重点，不在门禁一处拒绝。",
      "advisory": 6,
      "actual": 1
    },
    {
      "code": "SECTION_FIELD_SEMANTICS_MISMATCH",
      "section": "patterns",
      "heading": "## 实践模式",
      "detail": "本段由 `Concept.definition` + `examples` 填充，装出来的是**术语定义**，而骨架要求的是**可操作的模式**（编号子节、含表格）。条目数达标不代表语义达标——这类缺口计数查不出来。",
      "required": null,
      "actual": 8
    },
    {
      "code": "CONTRACT_FIELD_UNSUPPORTED",
      "section": "contract.inputContract",
      "heading": "契约字段 inputContract",
      "detail": "输入契约。没有任何对象字段描述「这个 skill 要什么输入」。",
      "required": null,
      "actual": 0
    },
    {
      "code": "CONTRACT_FIELD_UNSUPPORTED",
      "section": "contract.outputContract",
      "heading": "契约字段 outputContract",
      "detail": "输出契约。同上。",
      "required": null,
      "actual": 0
    },
    {
      "code": "CONTRACT_FIELD_UNSUPPORTED",
      "section": "contract.tools",
      "heading": "契约字段 tools",
      "detail": "工具清单。对象模型里没有工具/依赖类字段。",
      "required": null,
      "actual": 0
    },
    {
      "code": "CONTRACT_FIELD_UNSUPPORTED",
      "section": "contract.steps",
      "heading": "契约字段 steps",
      "detail": "可执行步骤。步骤属「实践模式」段的语义，而该段当前由 Concept 定义填充。",
      "required": null,
      "actual": 0
    },
    {
      "code": "CONTRACT_FIELD_UNSUPPORTED",
      "section": "contract.stopConditions",
      "heading": "契约字段 stopConditions",
      "detail": "停止条件。没有对象字段承载。",
      "required": null,
      "actual": 0
    },
    {
      "code": "CONTRACT_FIELD_UNSUPPORTED",
      "section": "contract.rollback",
      "heading": "契约字段 rollback",
      "detail": "回滚方式。没有对象字段承载。",
      "required": null,
      "actual": 0
    },
    {
      "code": "CONTRACT_FIELD_UNSUPPORTED",
      "section": "contract.tests",
      "heading": "契约字段 tests",
      "detail": "ADR-004 要求 ≥2。没有任何对象字段承载「这个 skill 怎么测」。",
      "required": null,
      "actual": 0
    },
    {
      "code": "SECTION_SOURCE_GRANULARITY_COARSE",
      "section": "code",
      "heading": "## 配套代码",
      "detail": "本段列的是**本章全部** 10 个代码目录，不是本簇专属。理由：对象模型没有「锚点 → 代码目录」的映射字段，章级列举是当前唯一可确定派生的口径。",
      "required": null,
      "actual": 10,
      "coarse": true
    }
  ],
  "sectionCounts": {
    "whenToUse": 5,
    "principles": 4,
    "patterns": 8,
    "pitfalls": 1,
    "code": 10,
    "reading": 8
  },
  "riskFlags": [
    {
      "flag": "PITFALL_COVERAGE_BELOW_ADVISORY",
      "detail": "anti-pattern 覆盖不足：常见陷阱段 1 条，建议值 6 条。",
      "routing": "按 ADR-006 门禁三，本 skill 属高风险，抽样时优先覆盖。"
    }
  ],
  "gapCodes": [
    "SECTION_ITEM_COUNT_BELOW_ADVISORY",
    "SECTION_FIELD_SEMANTICS_MISMATCH",
    "CONTRACT_FIELD_UNSUPPORTED",
    "CONTRACT_FIELD_UNSUPPORTED",
    "CONTRACT_FIELD_UNSUPPORTED",
    "CONTRACT_FIELD_UNSUPPORTED",
    "CONTRACT_FIELD_UNSUPPORTED",
    "CONTRACT_FIELD_UNSUPPORTED",
    "CONTRACT_FIELD_UNSUPPORTED",
    "SECTION_SOURCE_GRANULARITY_COARSE"
  ],
  "provenance": {
    "sourceFile": "sources/ai-agent-book-zh/book/afterword.md",
    "anchorIndexHash": "sha256:2f7a7ed1792c7d05675b21c58e2998cf70971bde65f1d06c088b16feee41bb63",
    "anchorIndexHashes": {
      "sources/ai-agent-book-zh/book/afterword.md": "sha256:2f7a7ed1792c7d05675b21c58e2998cf70971bde65f1d06c088b16feee41bb63",
      "sources/ai-agent-book-zh/book/chapter9.md": "sha256:855e8b9af9cb72f891452542825fa5e2886e763af0429c715fc7d3a7f5a6592d"
    },
    "objectsFile": "pipeline/knowledge/afterword.objects.json + pipeline/knowledge/chapter9.objects.json",
    "objectsFileSha256": "sha256:ed02b60c1afe9586f32d1672384deab16c3f1667da5576e38eebef226d509744",
    "objectsTotal": 37,
    "objectsInCluster": 15,
    "objectsKept": 15,
    "objectsExcludedByGate": [],
    "crossChapterTotal": 14,
    "crossChapterInCluster": 0,
    "crossChapterKept": 0,
    "crossChapterExcludedByGate": [],
    "antipatternVerdictsFile": "pipeline/registry/run-6bc0e8a0e8b9.antipattern-verdicts.json",
    "antipatternVerdictsRunId": "run-6bc0e8a0e8b9",
    "antipatternVerdictsIdentityMatch": true,
    "antipatternObjectsRunId": "run-6bc0e8a0e8b9",
    "gateReceiptFile": "pipeline/registry/run-6e6a6dea9b51.receipt.json",
    "gateReceiptRunId": "run-6e6a6dea9b51",
    "clusterSource": "clusters.json",
    "clusterSkillId": "chapter9-s2",
    "clusterUnits": [
      "chapter9-u3",
      "chapter9-u5",
      "chapter9-u9",
      "afterword-u1",
      "afterword-u2",
      "afterword-u3"
    ],
    "clusterChapterRefs": [
      "afterword",
      "chapter9"
    ],
    "clustersFile": "pipeline/knowledge/clusters.json"
  }
}
