{
  "schemaVersion": "skill-contract/v1",
  "skillId": "ch16-01-threads-s1",
  "name": "ch16-01-threads-s1",
  "description": "Rust 多线程任务管理：Rust 标准库只提供 1:1 线程模型实现；适用于使用 Rust 标准库提供的线程模型时、当多个线程并发运行且它们的执行顺序会影响程序行为或输出时、当需要修复新建线程未执行或未完整执行的问题，并确保其在 main 退出前结束运行时。",
  "references": [],
  "overflow": {
    "applied": false
  },
  "promotionState": "assembled",
  "gateReceipt": {
    "passed": true,
    "reasonCodes": [],
    "bytes": 4798,
    "markdownHash": "sha256:db857686a6f80e3344bb070064245c1f2c3dbf6bf02126500865c8e06dea933a",
    "checkedAt": "2026-10-14T21:46:01.753Z"
  },
  "inputContract": null,
  "outputContract": null,
  "tools": [],
  "steps": [],
  "stopConditions": [],
  "rollback": null,
  "tests": [],
  "sourceObjects": [
    "CH16-01-THREADS-H2-1-CONCEPT-01",
    "CH16-01-THREADS-H2-1-ENGINEERINGRULE-02",
    "CH16-01-THREADS-H3-1-CONCEPT-01",
    "CH16-01-THREADS-H3-1-ENGINEERINGRULE-02",
    "CH16-01-THREADS-H4-1-CONCEPT-01",
    "CH16-01-THREADS-H4-1-ENGINEERINGRULE-02",
    "CH16-01-THREADS-H3-2-CONCEPT-01",
    "CH16-01-THREADS-H3-2-ENGINEERINGRULE-02"
  ],
  "crossChapterObjects": [
    "AP-SYNTH-T07-01",
    "AP-SYNTH-T07-02",
    "AP-SYNTH-T09-08"
  ],
  "sourceRefs": [
    {
      "file": "sources/rust-book-cn/book/ch16-01-threads.md",
      "anchor": "ch16-01-threads#h2-1",
      "title": "使用线程同时运行代码",
      "lineStart": 1,
      "lineEnd": 24
    },
    {
      "file": "sources/rust-book-cn/book/ch16-01-threads.md",
      "anchor": "ch16-01-threads#h3-1",
      "title": "使用 `spawn` 创建新线程",
      "lineStart": 25,
      "lineEnd": 69
    },
    {
      "file": "sources/rust-book-cn/book/ch16-01-threads.md",
      "anchor": "ch16-01-threads#h4-1",
      "title": "使用 `join` 等待所有线程结束",
      "lineStart": 70,
      "lineEnd": 165
    },
    {
      "file": "sources/rust-book-cn/book/ch16-01-threads.md",
      "anchor": "ch16-01-threads#h3-2",
      "title": "线程与 `move` 闭包",
      "lineStart": 166,
      "lineEnd": 286
    }
  ],
  "codeSource": {
    "available": false,
    "note": "> 本段无来源：信息源未提供目录化的配套代码（`sources/<源键>/code/` 无可消费目录）。按**源条件骨架**（ADR-029），本段以来源说明代替空段——请勿读成「源里有代码但没写」。"
  },
  "evidenceGrade": "E2-derived",
  "freshness": {
    "state": "fresh",
    "asOf": "2026-10-14T21:46:01.753Z"
  },
  "gaps": [
    {
      "code": "SECTION_ITEM_COUNT_BELOW_ADVISORY",
      "section": "whenToUse",
      "heading": "## 何时使用",
      "detail": "条目数 4 低于骨架的建议值（列表，5–8 条用户场景/触发条件）。**建议值不是判据**——原书那 6–8 条出自人工写作，自动提取达不到该量级（实测整章仅 5 条）。本项按 ADR-006 门禁三「AntiPattern 覆盖率低的 skill 属高风险」路由到功效抽样重点，不在门禁一处拒绝。",
      "advisory": 5,
      "actual": 4
    },
    {
      "code": "SECTION_ITEM_COUNT_BELOW_ADVISORY",
      "section": "pitfalls",
      "heading": "## 常见陷阱",
      "detail": "条目数 3 低于骨架的建议值（列表，6–8 条反模式）。**建议值不是判据**——原书那 6–8 条出自人工写作，自动提取达不到该量级（实测整章仅 5 条）。本项按 ADR-006 门禁三「AntiPattern 覆盖率低的 skill 属高风险」路由到功效抽样重点，不在门禁一处拒绝。",
      "advisory": 6,
      "actual": 3
    },
    {
      "code": "SECTION_SOURCE_ABSENT",
      "section": "code",
      "heading": "## 配套代码",
      "detail": "本段的来源是镜像的代码树（`sources/<源键>/code/`），信息源未提供可消费的目录形态。按源条件骨架（ADR-029），本段以**来源说明**代替空段——「空」与「无」必须长得不一样。",
      "advisory": 1,
      "actual": 0
    },
    {
      "code": "SECTION_FIELD_SEMANTICS_MISMATCH",
      "section": "patterns",
      "heading": "## 实践模式",
      "detail": "本段由 `Concept.definition` + `examples` 填充，装出来的是**术语定义**，而骨架要求的是**可操作的模式**（编号子节、含表格）。条目数达标不代表语义达标——这类缺口计数查不出来。",
      "required": null,
      "actual": 4
    },
    {
      "code": "CONTRACT_FIELD_UNSUPPORTED",
      "section": "contract.inputContract",
      "heading": "契约字段 inputContract",
      "detail": "输入契约。没有任何对象字段描述「这个 skill 要什么输入」。",
      "required": null,
      "actual": 0
    },
    {
      "code": "CONTRACT_FIELD_UNSUPPORTED",
      "section": "contract.outputContract",
      "heading": "契约字段 outputContract",
      "detail": "输出契约。同上。",
      "required": null,
      "actual": 0
    },
    {
      "code": "CONTRACT_FIELD_UNSUPPORTED",
      "section": "contract.tools",
      "heading": "契约字段 tools",
      "detail": "工具清单。对象模型里没有工具/依赖类字段。",
      "required": null,
      "actual": 0
    },
    {
      "code": "CONTRACT_FIELD_UNSUPPORTED",
      "section": "contract.steps",
      "heading": "契约字段 steps",
      "detail": "可执行步骤。步骤属「实践模式」段的语义，而该段当前由 Concept 定义填充。",
      "required": null,
      "actual": 0
    },
    {
      "code": "CONTRACT_FIELD_UNSUPPORTED",
      "section": "contract.stopConditions",
      "heading": "契约字段 stopConditions",
      "detail": "停止条件。没有对象字段承载。",
      "required": null,
      "actual": 0
    },
    {
      "code": "CONTRACT_FIELD_UNSUPPORTED",
      "section": "contract.rollback",
      "heading": "契约字段 rollback",
      "detail": "回滚方式。没有对象字段承载。",
      "required": null,
      "actual": 0
    },
    {
      "code": "CONTRACT_FIELD_UNSUPPORTED",
      "section": "contract.tests",
      "heading": "契约字段 tests",
      "detail": "ADR-004 要求 ≥2。没有任何对象字段承载「这个 skill 怎么测」。",
      "required": null,
      "actual": 0
    }
  ],
  "sectionCounts": {
    "whenToUse": 4,
    "principles": 4,
    "patterns": 4,
    "pitfalls": 3,
    "code": 0,
    "reading": 4
  },
  "riskFlags": [
    {
      "flag": "PITFALL_COVERAGE_BELOW_ADVISORY",
      "detail": "anti-pattern 覆盖不足：常见陷阱段 3 条，建议值 6 条。",
      "routing": "按 ADR-006 门禁三，本 skill 属高风险，抽样时优先覆盖。"
    }
  ],
  "gapCodes": [
    "SECTION_ITEM_COUNT_BELOW_ADVISORY",
    "SECTION_ITEM_COUNT_BELOW_ADVISORY",
    "SECTION_SOURCE_ABSENT",
    "SECTION_FIELD_SEMANTICS_MISMATCH",
    "CONTRACT_FIELD_UNSUPPORTED",
    "CONTRACT_FIELD_UNSUPPORTED",
    "CONTRACT_FIELD_UNSUPPORTED",
    "CONTRACT_FIELD_UNSUPPORTED",
    "CONTRACT_FIELD_UNSUPPORTED",
    "CONTRACT_FIELD_UNSUPPORTED",
    "CONTRACT_FIELD_UNSUPPORTED"
  ],
  "provenance": {
    "sourceFile": "sources/rust-book-cn/book/ch16-01-threads.md",
    "anchorIndexHash": "sha256:71543fe7a36a82025e702e7968d9b9396091d2209c45a4f08e6eb332f230aa79",
    "anchorIndexHashes": {
      "sources/rust-book-cn/book/ch16-01-threads.md": "sha256:71543fe7a36a82025e702e7968d9b9396091d2209c45a4f08e6eb332f230aa79"
    },
    "objectsFile": "pipeline/knowledge/ch16-01-threads.objects.json",
    "objectsFileSha256": "sha256:448da73f3f35225578fc368461118637f324a63da9551142a2f5fa7962cfbcd0",
    "objectsTotal": 8,
    "objectsInCluster": 8,
    "objectsKept": 8,
    "objectsExcludedByGate": [],
    "crossChapterTotal": 95,
    "crossChapterInCluster": 3,
    "crossChapterKept": 3,
    "crossChapterExcludedByGate": [],
    "antipatternVerdictsFile": "pipeline/registry/run-fd491f2468f0.antipattern-verdicts.json",
    "antipatternVerdictsRunId": "run-fd491f2468f0",
    "antipatternVerdictsIdentityMatch": true,
    "antipatternObjectsRunId": "run-fd491f2468f0",
    "gateReceiptFile": "pipeline/registry/run-bc19ea3da9e2.receipt.json",
    "gateReceiptRunId": "run-bc19ea3da9e2",
    "clusterSource": "pipeline/knowledge/clusters.rust-book-cn.json",
    "clusterSkillId": "ch16-01-threads-s1",
    "clusterUnits": [
      "ch16-01-threads-u1",
      "ch16-01-threads-u2",
      "ch16-01-threads-u3",
      "ch16-01-threads-u4"
    ],
    "clusterChapterRefs": [
      "ch16-01-threads"
    ],
    "clustersFile": "pipeline/knowledge/clusters.rust-book-cn.json"
  }
}
