{
  "schemaVersion": "skill-contract/v1",
  "skillId": "ch13-02-iterators-s1",
  "name": "ch13-02-iterators-s1",
  "description": "使用标准迭代器处理序列：调用 `sum` 之后不再允许使用 `v1_iter`，因为调用 `sum` 时它会获取迭代器的所有权；适用于调用 `sum` 之后、调用迭代器适配器方法并需要获取其结果时、在 Rust 中为某个类型实现标准库的 `Iterator` trait 时。",
  "references": [],
  "overflow": {
    "applied": false
  },
  "promotionState": "assembled",
  "gateReceipt": {
    "passed": true,
    "reasonCodes": [],
    "bytes": 5708,
    "markdownHash": "sha256:02a0da6c91762f63d6eb91e93034f13520e63fa08ffe6da1d7a8935bcb287323",
    "checkedAt": "2026-10-14T19:06:28.693Z"
  },
  "inputContract": null,
  "outputContract": null,
  "tools": [],
  "steps": [],
  "stopConditions": [],
  "rollback": null,
  "tests": [],
  "sourceObjects": [
    "CH13-02-ITERATORS-H2-1-CONCEPT-01",
    "CH13-02-ITERATORS-H3-1-CONCEPT-01",
    "CH13-02-ITERATORS-H3-1-MENTALMODEL-02",
    "CH13-02-ITERATORS-H3-2-CONCEPT-01",
    "CH13-02-ITERATORS-H3-2-ENGINEERINGRULE-02",
    "CH13-02-ITERATORS-H3-3-CONCEPT-01",
    "CH13-02-ITERATORS-H3-3-ENGINEERINGRULE-02",
    "CH13-02-ITERATORS-H3-4-CONCEPT-01",
    "CH13-02-ITERATORS-H3-5-ENGINEERINGRULE-01",
    "CH13-02-ITERATORS-H4-1-CONCEPT-01",
    "CH13-02-ITERATORS-H4-1-CASE-02",
    "CH13-02-ITERATORS-H4-2-CONCEPT-01",
    "CH13-02-ITERATORS-H4-2-CONCEPT-02"
  ],
  "crossChapterObjects": [
    "AP-SYNTH-T09-01",
    "AP-SYNTH-T09-04"
  ],
  "sourceRefs": [
    {
      "file": "sources/rust-book-cn/book/ch13-02-iterators.md",
      "anchor": "ch13-02-iterators#h2-1",
      "title": "使用迭代器处理元素序列",
      "lineStart": 1,
      "lineEnd": 34
    },
    {
      "file": "sources/rust-book-cn/book/ch13-02-iterators.md",
      "anchor": "ch13-02-iterators#h3-1",
      "title": "`Iterator` trait 和 `next` 方法",
      "lineStart": 35,
      "lineEnd": 76
    },
    {
      "file": "sources/rust-book-cn/book/ch13-02-iterators.md",
      "anchor": "ch13-02-iterators#h3-2",
      "title": "消费迭代器的方法",
      "lineStart": 77,
      "lineEnd": 101
    },
    {
      "file": "sources/rust-book-cn/book/ch13-02-iterators.md",
      "anchor": "ch13-02-iterators#h3-3",
      "title": "产生其他迭代器的方法",
      "lineStart": 102,
      "lineEnd": 150
    },
    {
      "file": "sources/rust-book-cn/book/ch13-02-iterators.md",
      "anchor": "ch13-02-iterators#h3-4",
      "title": "使用闭包获取环境",
      "lineStart": 151,
      "lineEnd": 201
    },
    {
      "file": "sources/rust-book-cn/book/ch13-02-iterators.md",
      "anchor": "ch13-02-iterators#h3-5",
      "title": "实现 `Iterator` trait 来创建自定义迭代器",
      "lineStart": 202,
      "lineEnd": 257
    },
    {
      "file": "sources/rust-book-cn/book/ch13-02-iterators.md",
      "anchor": "ch13-02-iterators#h4-1",
      "title": "使用 `Counter` 迭代器的 `next` 方法",
      "lineStart": 258,
      "lineEnd": 299
    },
    {
      "file": "sources/rust-book-cn/book/ch13-02-iterators.md",
      "anchor": "ch13-02-iterators#h4-2",
      "title": "使用自定义迭代器中其他 `Iterator` trait 方法",
      "lineStart": 300,
      "lineEnd": 352
    },
    {
      "file": "sources/rust-book-cn/book/ch03-05-control-flow.md",
      "anchor": "ch03-05-control-flow#h4-6",
      "title": "使用 `for` 遍历集合",
      "lineStart": 198,
      "lineEnd": 245
    }
  ],
  "codeSource": {
    "available": false,
    "note": "> 本段无来源：信息源未提供目录化的配套代码（`sources/<源键>/code/` 无可消费目录）。按**源条件骨架**（ADR-029），本段以来源说明代替空段——请勿读成「源里有代码但没写」。"
  },
  "evidenceGrade": "E2-derived",
  "freshness": {
    "state": "fresh",
    "asOf": "2026-10-14T19:06:28.693Z"
  },
  "gaps": [
    {
      "code": "SECTION_ITEM_COUNT_BELOW_ADVISORY",
      "section": "whenToUse",
      "heading": "## 何时使用",
      "detail": "条目数 3 低于骨架的建议值（列表，5–8 条用户场景/触发条件）。**建议值不是判据**——原书那 6–8 条出自人工写作，自动提取达不到该量级（实测整章仅 5 条）。本项按 ADR-006 门禁三「AntiPattern 覆盖率低的 skill 属高风险」路由到功效抽样重点，不在门禁一处拒绝。",
      "advisory": 5,
      "actual": 3
    },
    {
      "code": "SECTION_ITEM_COUNT_BELOW_ADVISORY",
      "section": "pitfalls",
      "heading": "## 常见陷阱",
      "detail": "条目数 2 低于骨架的建议值（列表，6–8 条反模式）。**建议值不是判据**——原书那 6–8 条出自人工写作，自动提取达不到该量级（实测整章仅 5 条）。本项按 ADR-006 门禁三「AntiPattern 覆盖率低的 skill 属高风险」路由到功效抽样重点，不在门禁一处拒绝。",
      "advisory": 6,
      "actual": 2
    },
    {
      "code": "SECTION_SOURCE_ABSENT",
      "section": "code",
      "heading": "## 配套代码",
      "detail": "本段的来源是镜像的代码树（`sources/<源键>/code/`），信息源未提供可消费的目录形态。按源条件骨架（ADR-029），本段以**来源说明**代替空段——「空」与「无」必须长得不一样。",
      "advisory": 1,
      "actual": 0
    },
    {
      "code": "SECTION_FIELD_SEMANTICS_MISMATCH",
      "section": "patterns",
      "heading": "## 实践模式",
      "detail": "本段由 `Concept.definition` + `examples` 填充，装出来的是**术语定义**，而骨架要求的是**可操作的模式**（编号子节、含表格）。条目数达标不代表语义达标——这类缺口计数查不出来。",
      "required": null,
      "actual": 8
    },
    {
      "code": "CONTRACT_FIELD_UNSUPPORTED",
      "section": "contract.inputContract",
      "heading": "契约字段 inputContract",
      "detail": "输入契约。没有任何对象字段描述「这个 skill 要什么输入」。",
      "required": null,
      "actual": 0
    },
    {
      "code": "CONTRACT_FIELD_UNSUPPORTED",
      "section": "contract.outputContract",
      "heading": "契约字段 outputContract",
      "detail": "输出契约。同上。",
      "required": null,
      "actual": 0
    },
    {
      "code": "CONTRACT_FIELD_UNSUPPORTED",
      "section": "contract.tools",
      "heading": "契约字段 tools",
      "detail": "工具清单。对象模型里没有工具/依赖类字段。",
      "required": null,
      "actual": 0
    },
    {
      "code": "CONTRACT_FIELD_UNSUPPORTED",
      "section": "contract.steps",
      "heading": "契约字段 steps",
      "detail": "可执行步骤。步骤属「实践模式」段的语义，而该段当前由 Concept 定义填充。",
      "required": null,
      "actual": 0
    },
    {
      "code": "CONTRACT_FIELD_UNSUPPORTED",
      "section": "contract.stopConditions",
      "heading": "契约字段 stopConditions",
      "detail": "停止条件。没有对象字段承载。",
      "required": null,
      "actual": 0
    },
    {
      "code": "CONTRACT_FIELD_UNSUPPORTED",
      "section": "contract.rollback",
      "heading": "契约字段 rollback",
      "detail": "回滚方式。没有对象字段承载。",
      "required": null,
      "actual": 0
    },
    {
      "code": "CONTRACT_FIELD_UNSUPPORTED",
      "section": "contract.tests",
      "heading": "契约字段 tests",
      "detail": "ADR-004 要求 ≥2。没有任何对象字段承载「这个 skill 怎么测」。",
      "required": null,
      "actual": 0
    }
  ],
  "sectionCounts": {
    "whenToUse": 3,
    "principles": 3,
    "patterns": 8,
    "pitfalls": 2,
    "code": 0,
    "reading": 9
  },
  "riskFlags": [
    {
      "flag": "PITFALL_COVERAGE_BELOW_ADVISORY",
      "detail": "anti-pattern 覆盖不足：常见陷阱段 2 条，建议值 6 条。",
      "routing": "按 ADR-006 门禁三，本 skill 属高风险，抽样时优先覆盖。"
    }
  ],
  "gapCodes": [
    "SECTION_ITEM_COUNT_BELOW_ADVISORY",
    "SECTION_ITEM_COUNT_BELOW_ADVISORY",
    "SECTION_SOURCE_ABSENT",
    "SECTION_FIELD_SEMANTICS_MISMATCH",
    "CONTRACT_FIELD_UNSUPPORTED",
    "CONTRACT_FIELD_UNSUPPORTED",
    "CONTRACT_FIELD_UNSUPPORTED",
    "CONTRACT_FIELD_UNSUPPORTED",
    "CONTRACT_FIELD_UNSUPPORTED",
    "CONTRACT_FIELD_UNSUPPORTED",
    "CONTRACT_FIELD_UNSUPPORTED"
  ],
  "provenance": {
    "sourceFile": "sources/rust-book-cn/book/ch13-02-iterators.md",
    "anchorIndexHash": "sha256:b595e3aee636927ab1dffb59f1d501b46c6b757b0f931fe35dbd0525efcd0bc4",
    "anchorIndexHashes": {
      "sources/rust-book-cn/book/ch13-02-iterators.md": "sha256:b595e3aee636927ab1dffb59f1d501b46c6b757b0f931fe35dbd0525efcd0bc4",
      "sources/rust-book-cn/book/ch03-05-control-flow.md": "sha256:e002508b3a37c634506725609e163971c4fef6d78f0a2662b6ec31684972957f"
    },
    "objectsFile": "pipeline/knowledge/ch13-02-iterators.objects.json",
    "objectsFileSha256": "sha256:944f9488523807b43ac0a1f771386981478e0696a3d54a269d0fb6dfd169fc66",
    "objectsTotal": 13,
    "objectsInCluster": 13,
    "objectsKept": 13,
    "objectsExcludedByGate": [],
    "crossChapterTotal": 95,
    "crossChapterInCluster": 2,
    "crossChapterKept": 2,
    "crossChapterExcludedByGate": [],
    "antipatternVerdictsFile": "pipeline/registry/run-fd491f2468f0.antipattern-verdicts.json",
    "antipatternVerdictsRunId": "run-fd491f2468f0",
    "antipatternVerdictsIdentityMatch": true,
    "antipatternObjectsRunId": "run-fd491f2468f0",
    "gateReceiptFile": "pipeline/registry/run-7099422717fd.receipt.json",
    "gateReceiptRunId": "run-7099422717fd",
    "clusterSource": "pipeline/knowledge/clusters.rust-book-cn.json",
    "clusterSkillId": "ch13-02-iterators-s1",
    "clusterUnits": [
      "ch13-02-iterators-u1",
      "ch13-02-iterators-u2",
      "ch13-02-iterators-u3"
    ],
    "clusterChapterRefs": [
      "ch13-02-iterators"
    ],
    "clustersFile": "pipeline/knowledge/clusters.rust-book-cn.json"
  }
}
